{
  "run_id": "full_demo",
  "status": "NOT_DONE",
  "reason": "Hard validation failure exists before policy decision.",
  "required_verifier_level": "P2",
  "certifying_artifacts": [],
  "provisional_artifacts": [],
  "rejected_artifacts": [
    "2.json touched file missing: test_roman_to_int.py",
    "step 1 action mismatch: expected write, got create_file",
    "PlanGraph validation failed"
  ],
  "policy_checks": [
    "verifier contract exists",
    "target artifact exists",
    "hard validation failure blocks certification"
  ],
  "generated_at": "2026-05-10T08:29:28.562116+00:00"
}