{
  "run_id": "he_h81",
  "status": "CERTIFIED_DONE",
  "reason": "At least one P2/P3 verifier artifact has certifying strength and satisfies the verifier contract.",
  "required_verifier_level": "P2",
  "certifying_artifacts": [
    "V.HE_H81"
  ],
  "provisional_artifacts": [],
  "rejected_artifacts": [],
  "policy_checks": [
    "verifier contract exists",
    "target artifact exists",
    "verifier artifact exists",
    "target artifact matches verifier contract",
    "provenance level is P2",
    "provenance level meets required P2",
    "verifier authority is certifying",
    "same_worker_as_solution is false",
    "strength level is certifying",
    "no disqualifying smell"
  ],
  "generated_at": "2026-05-10T07:22:45.339107+00:00"
}