{
  "run_id": "build_pipeline",
  "status": "NOT_DONE",
  "reason": "Verifier target artifact is missing.",
  "required_verifier_level": "P2",
  "certifying_artifacts": [],
  "provisional_artifacts": [],
  "rejected_artifacts": [
    "missing target artifact: .agentic-pi/runtime/orchestrate_pipeline.py"
  ],
  "policy_checks": [
    "verifier contract exists",
    "target artifact missing"
  ],
  "generated_at": "2026-05-10T09:52:09.608492+00:00"
}